{
  "schema": 1,
  "beats": {
    "triage": true,
    "aim": true,
    "spec": true,
    "monitor": true
  },
  "ledger": true,
  "memory": true,
  "routing": true,
  "agents_md": "auto",
  "loop": {
    "enabled": true,
    "window": "14d",
    "min_occurrences": 2,
    "max_open_prs": 1,
    "cooldown_windows": 2
  },
  "human_gates": ["spec-approval", "merge", "loop-pr", "routing-change"],
  "monitor": {
    "watch_minutes": 30,
    "sources": []
  }
}
